Ticket ID,Customer Name,Customer Email,Product Purchased,Date of Purchase,Ticket Type,Ticket Subject,Ticket Description,Ticket Status,Ticket Priority,Ticket Channel,First Response Time
1,Marisa Obrien,carrollallison@example.com,GoPro Hero,22-03-2021,Technical issue,Product setup,"I'm having an issue with the {product_purchased}. Please assist.

Your billing zip code is: 71701.

We appreciate that you have requested a website address.

Please double check your email address. I've tried troubleshooting steps mentioned in the user manual, but the issue persists.",Pending Customer Response,Critical,Social media,01-06-2023 12:15
25,John Cuevas,lbarron@example.org,Amazon Kindle,25-05-2021,Product inquiry,Display issue,"I'm having an issue with the {product_purchased}. Please assist. {product_purchased} does not represent the price which you received by the day immediately before the shipment date.

In many cases, this is the I've noticed a sudden decrease in battery life on my {product_purchased}. It used to last much longer.",Open,Critical,Email,
75,Vanessa Hayes,donaldroberts@example.net,Xbox,16-04-2021,Billing inquiry,Product setup,"I'm having an issue with the {product_purchased}. Please assist. Please, take care of such requests.

[1] M.V.V.

[2] The above-mentioned is made up with specific I've checked the device settings and made sure that everything is configured correctly.",Open,Critical,Email,
28,Michael Mcdowell,jeffersonmichael@example.net,Fitbit Charge,12-10-2020,Cancellation request,Product setup,"I'm having an issue with the {product_purchased}. Please assist. {{product_purchased}} must be a valid email address for your order and are valid for one week in advance. Please make your purchases as quickly as possible The issue I'm facing is intermittent. Sometimes it works fine, but other times it acts up unexpectedly.",Open,High,Phone,
50,Katie Johnson,thomas46@example.net,Microsoft Office,27-09-2020,Technical issue,Display issue,"I'm having an issue with the {product_purchased}. Please assist. If you've received a refund, please contact Customer Service. Otherwise, please call us at 303.938.2837. I'm having an issue with the I'm concerned about the security of my {product_purchased} and would like to ensure that my data is safe.",Open,Medium,Chat,
71,Eileen Kim,gabriel83@example.com,Google Pixel,15-05-2021,Cancellation request,Product setup,"I've accidentally deleted important data from my {product_purchased}. Is there any way to recover the deleted files? I need them urgently. What about my {search } files?

The {product_purchased} is the I'm using the original charger that came with my {product_purchased}, but it's not charging properly.",Pending Customer Response,Medium,Chat,31-05-2023 23:49
14,Sandra Barnes,gwendolyn51@example.net,Nest Thermostat,13-07-2020,Technical issue,Product setup,"I've recently set up my {product_purchased}, but it fails to connect to any available networks. What steps should I take to troubleshoot this issue?

I can't find the 'Product_IP' field of the I'm concerned about the security of my {product_purchased} and would like to ensure that my data is safe.",Pending Customer Response,Low,Chat,01-06-2023 20:34
31,Wendy Roberts,jessicahenderson@example.net,Adobe Photoshop,28-01-2021,Billing inquiry,Product setup,"I'm having an issue with the {product_purchased}. Please assist.

I'm using a brand new product. What a strange situation.

I've just purchased a brand new one.

What to do? I've noticed that the issue occurs consistently when I use a specific feature or application on my {product_purchased}.",Open,Low,Email,
